{
  "schemaVersion": 1,
  "kind": "PUBLISHED_PROVIDER_CATALOG_SNAPSHOT",
  "snapshotId": "90000000-0000-4000-8000-000000000010",
  "canonicalizationVersion": "catalog-draft-canonical-json-1",
  "catalog": {
    "schemaVersion": 1,
    "catalogVersion": "example-proposal-1",
    "options": [
      {
        "id": "example-managed-eu",
        "providerId": "example",
        "product": "Example Identity",
        "plan": "Example Enterprise",
        "deployment": "MANAGED",
        "region": "EU",
        "configuration": "Primary pilot configuration",
        "facts": {
          "SCIM": {
            "availability": "OPTIONAL",
            "conditions": [
              "Configured pilot environment"
            ],
            "evidence": {
              "sourceUrl": "https://docs.example.invalid/identity/plan",
              "observedAt": "2026-09-12T12:00:00Z",
              "summary": "Fictional source paraphrase for validation tests only; not a real provider claim."
            }
          },
          "OIDC": {
            "availability": "OPTIONAL",
            "conditions": [
              "Configured pilot environment"
            ],
            "evidence": {
              "sourceUrl": "https://docs.example.invalid/identity/plan",
              "observedAt": "2026-09-12T12:00:00Z",
              "summary": "Fictional source paraphrase for validation tests only; not a real provider claim."
            }
          }
        },
        "compatibility": {
          "applications": {
            "B2B_SAAS": {
              "support": "SUPPORTED",
              "conditions": [
                "Configured pilot environment"
              ],
              "evidence": {
                "sourceUrl": "https://docs.example.invalid/identity/plan",
                "observedAt": "2026-09-12T12:00:00Z",
                "summary": "Fictional source paraphrase for validation tests only; not a real provider claim."
              }
            }
          },
          "clients": {
            "BROWSER": {
              "support": "SUPPORTED",
              "conditions": [
                "Configured pilot environment"
              ],
              "evidence": {
                "sourceUrl": "https://docs.example.invalid/identity/plan",
                "observedAt": "2026-09-12T12:00:00Z",
                "summary": "Fictional source paraphrase for validation tests only; not a real provider claim."
              }
            }
          },
          "populations": {
            "PARTNERS": {
              "support": "SUPPORTED",
              "conditions": [
                "Configured pilot environment"
              ],
              "evidence": {
                "sourceUrl": "https://docs.example.invalid/identity/plan",
                "observedAt": "2026-09-12T12:00:00Z",
                "summary": "Fictional source paraphrase for validation tests only; not a real provider claim."
              }
            }
          },
          "tenancy": {
            "MULTI_TENANT_ORGANIZATIONS": {
              "support": "SUPPORTED",
              "conditions": [
                "Configured pilot environment"
              ],
              "evidence": {
                "sourceUrl": "https://docs.example.invalid/identity/plan",
                "observedAt": "2026-09-12T12:00:00Z",
                "summary": "Fictional source paraphrase for validation tests only; not a real provider claim."
              }
            }
          },
          "membership": {
            "SINGLE_ORGANIZATION_PER_USER": {
              "support": "SUPPORTED",
              "conditions": [
                "Configured pilot environment"
              ],
              "evidence": {
                "sourceUrl": "https://docs.example.invalid/identity/plan",
                "observedAt": "2026-09-12T12:00:00Z",
                "summary": "Fictional source paraphrase for validation tests only; not a real provider claim."
              }
            }
          }
        },
        "residency": {
          "USER_PROFILES": {
            "coverage": "COMPLETE",
            "storageCountries": [
              "DE",
              "FR"
            ],
            "conditions": [
              "Configured pilot environment"
            ],
            "evidence": {
              "sourceUrl": "https://docs.example.invalid/identity/plan",
              "observedAt": "2026-09-12T12:00:00Z",
              "summary": "Fictional source paraphrase for validation tests only; not a real provider claim."
            }
          }
        },
        "authenticationControls": {
          "BROWSER": {
            "PARTNERS": {
              "PHISHING_RESISTANCE": {
                "availability": "SUPPORTED",
                "enforcement": "SUPPORTED",
                "conditions": [
                  "Configured pilot environment"
                ],
                "evidence": {
                  "sourceUrl": "https://docs.example.invalid/identity/plan",
                  "observedAt": "2026-09-12T12:00:00Z",
                  "summary": "Fictional source paraphrase for validation tests only; not a real provider claim."
                }
              }
            }
          }
        }
      }
    ]
  },
  "contentSha256": "aafdb589250bf8bae8c4cdcc806f0625802ef560909de4a8442dfd2c4be3f1b4",
  "previousSnapshot": null,
  "publication": {
    "decisionId": "90000000-0000-4000-8000-000000000011",
    "publishedAt": "2026-09-13T12:00:00Z"
  },
  "factEvidenceStatuses": [
    {
      "optionId": "example-managed-eu",
      "factPath": "facts.OIDC",
      "evidenceStatus": "REVIEWED"
    },
    {
      "optionId": "example-managed-eu",
      "factPath": "facts.SCIM",
      "evidenceStatus": "REVIEWED"
    },
    {
      "optionId": "example-managed-eu",
      "factPath": "compatibility.applications.B2B_SAAS",
      "evidenceStatus": "REVIEWED"
    },
    {
      "optionId": "example-managed-eu",
      "factPath": "compatibility.clients.BROWSER",
      "evidenceStatus": "REVIEWED"
    },
    {
      "optionId": "example-managed-eu",
      "factPath": "compatibility.populations.PARTNERS",
      "evidenceStatus": "REVIEWED"
    },
    {
      "optionId": "example-managed-eu",
      "factPath": "compatibility.tenancy.MULTI_TENANT_ORGANIZATIONS",
      "evidenceStatus": "REVIEWED"
    },
    {
      "optionId": "example-managed-eu",
      "factPath": "compatibility.membership.SINGLE_ORGANIZATION_PER_USER",
      "evidenceStatus": "REVIEWED"
    },
    {
      "optionId": "example-managed-eu",
      "factPath": "residency.USER_PROFILES",
      "evidenceStatus": "REVIEWED"
    },
    {
      "optionId": "example-managed-eu",
      "factPath": "authenticationControls.BROWSER.PARTNERS.PHISHING_RESISTANCE",
      "evidenceStatus": "REVIEWED"
    }
  ],
  "snapshotSha256": "a58bce209530b425138c3d560b2371668850c75232304e1225ecfff2c39f562f"
}
